smartctl 7.5 2025-04-30 r5714 [x86_64-linux-6.18.33-xanmod1] (local build)
Copyright (C) 2002-25, Bruce Allen, Christian Franke, www.smartmontools.org

=== START OF INFORMATION SECTION ===
Model Family:     Seagate Barracuda 7200.14 (AF)
Device Model:     ST250DM000-1BD141
Serial Number:    9VYGHFVR
LU WWN Device Id: 5 000c50 04d780e27
Firmware Version: KC45
User Capacity:    250,059,350,016 bytes [250 GB]
Sector Sizes:     512 bytes logical, 4096 bytes physical
Rotation Rate:    7200 rpm
Device is:        In smartctl database 7.5/5706
ATA Version is:   ATA8-ACS T13/1699-D revision 4
SATA Version is:  SATA 3.0, 6.0 Gb/s (current: 3.0 Gb/s)
Local Time is:    Sun May 31 22:58:33 2026 EDT
SMART support is: Available - device has SMART capability.
SMART support is: Enabled
AAM feature is:   Disabled
APM feature is:   Unavailable
Rd look-ahead is: Enabled
Write cache is:   Enabled
DSN feature is:   Unavailable
ATA Security is:  Disabled, NOT FROZEN [SEC1]

=== START OF READ SMART DATA SECTION ===
SMART overall-health self-assessment test result: PASSED

General SMART Values:
Offline data collection status:  (0x82)	Offline data collection activity
					was completed without error.
					Auto Offline Data Collection: Enabled.
Self-test execution status:      (   0)	The previous self-test routine completed
					without error or no self-test has ever 
					been run.
Total time to complete Offline 
data collection: 		(  609) seconds.
Offline data collection
capabilities: 			 (0x7b) SMART execute Offline immediate.
					Auto Offline data collection on/off support.
					Suspend Offline collection upon new
					command.
					Offline surface scan supported.
					Self-test supported.
					Conveyance Self-test supported.
					Selective Self-test supported.
SMART capabilities:            (0x0003)	Saves SMART data before entering
					power-saving mode.
					Supports SMART auto save timer.
Error logging capability:        (0x01)	Error logging supported.
					General Purpose Logging supported.
Short self-test routine 
recommended polling time: 	 (   1) minutes.
Extended self-test routine
recommended polling time: 	 (  46) minutes.
Conveyance self-test routine
recommended polling time: 	 (   2) minutes.
SCT capabilities: 	       (0x303f)	SCT Status supported.
					SCT Error Recovery Control supported.
					SCT Feature Control supported.
					SCT Data Table supported.

SMART Attributes Data Structure revision number: 10
Vendor Specific SMART Attributes with Thresholds:
ID# ATTRIBUTE_NAME          FLAGS    VALUE WORST THRESH FAIL RAW_VALUE
  1 Raw_Read_Error_Rate     POSR--   110   099   006    -    2003784
  3 Spin_Up_Time            PO----   100   098   000    -    0
  4 Start_Stop_Count        -O--CK   099   099   020    -    1716
  5 Reallocated_Sector_Ct   PO--CK   100   100   036    -    0
  7 Seek_Error_Rate         POSR--   085   060   030    -    4659933581
  9 Power_On_Hours          -O--CK   064   064   000    -    31816
 10 Spin_Retry_Count        PO--C-   100   100   097    -    0
 12 Power_Cycle_Count       -O--CK   099   099   020    -    1706
183 Runtime_Bad_Block       -O--CK   100   100   000    -    0
184 End-to-End_Error        -O--CK   100   100   099    -    0
187 Reported_Uncorrect      -O--CK   001   001   000    -    493
188 Command_Timeout         -O--CK   100   098   000    -    4 4 5
189 High_Fly_Writes         -O-RCK   100   100   000    -    0
190 Airflow_Temperature_Cel -O---K   065   061   045    -    35 (Min/Max 34/36)
194 Temperature_Celsius     -O---K   035   040   000    -    35 (0 12 0 0 0)
195 Hardware_ECC_Recovered  -O-RC-   050   018   000    -    2003784
197 Current_Pending_Sector  -O--C-   100   100   000    -    0
198 Offline_Uncorrectable   ----C-   100   100   000    -    0
199 UDMA_CRC_Error_Count    -OSRCK   200   200   000    -    0
240 Head_Flying_Hours       ------   100   253   000    -    31796h+25m+01.637s
241 Total_LBAs_Written      ------   100   253   000    -    1145182261
242 Total_LBAs_Read         ------   100   253   000    -    1107494790
                            ||||||_ K auto-keep
                            |||||__ C event count
                            ||||___ R error rate
                            |||____ S speed/performance
                            ||_____ O updated online
                            |______ P prefailure warning

General Purpose Log Directory Version 1
SMART           Log Directory Version 1 [multi-sector log support]
Address    Access  R/W   Size  Description
0x00       GPL,SL  R/O      1  Log Directory
0x01           SL  R/O      1  Summary SMART error log
0x02           SL  R/O      5  Comprehensive SMART error log
0x03       GPL     R/O      5  Ext. Comprehensive SMART error log
0x06           SL  R/O      1  SMART self-test log
0x07       GPL     R/O      1  Extended self-test log
0x09           SL  R/W      1  Selective self-test log
0x10       GPL     R/O      1  NCQ Command Error log
0x11       GPL     R/O      1  SATA Phy Event Counters log
0x21       GPL     R/O      1  Write stream error log
0x22       GPL     R/O      1  Read stream error log
0x80-0x9f  GPL,SL  R/W     16  Host vendor specific log
0xa1       GPL,SL  VS      20  Device vendor specific log
0xa2       GPL     VS    2248  Device vendor specific log
0xa8       GPL,SL  VS     129  Device vendor specific log
0xa9       GPL,SL  VS       1  Device vendor specific log
0xab       GPL     VS       1  Device vendor specific log
0xb0       GPL     VS    2928  Device vendor specific log
0xbd       GPL     VS     252  Device vendor specific log
0xbe-0xbf  GPL     VS   65535  Device vendor specific log
0xc0       GPL,SL  VS       1  Device vendor specific log
0xe0       GPL,SL  R/W      1  SCT Command/Status
0xe1       GPL,SL  R/W      1  SCT Data Transfer

SMART Extended Comprehensive Error Log Version: 1 (5 sectors)
Device Error Count: 485 (device log contains only the most recent 20 errors)
	CR     = Command Register
	FEATR  = Features Register
	COUNT  = Count (was: Sector Count) Register
	LBA_48 = Upper bytes of LBA High/Mid/Low Registers ]  ATA-8
	LH     = LBA High (was: Cylinder High) Register    ]   LBA
	LM     = LBA Mid (was: Cylinder Low) Register      ] Register
	LL     = LBA Low (was: Sector Number) Register     ]
	DV     = Device (was: Device/Head) Register
	DC     = Device Control Register
	ER     = Error register
	ST     = Status register
Powered_Up_Time is measured from power on, and printed as
DDd+hh:mm:SS.sss where DD=days, hh=hours, mm=minutes,
SS=sec, and sss=millisec. It "wraps" after 49.710 days.

Error 485 [4] occurred at disk power-on lifetime: 16221 hours (675 days + 21 hours)
  When the command that caused the error occurred, the device was active or idle.

  After command completion occurred, registers were:
  ER -- ST COUNT  LBA_48  LH LM LL DV DC
  -- -- -- == -- == == == -- -- -- -- --
  40 -- 51 00 00 00 00 02 b1 44 a8 00 00  Error: UNC at LBA = 0x02b144a8 = 45171880

  Commands leading to the command that caused the error were:
  CR FEATR COUNT  LBA_48  LH LM LL DV DC  Powered_Up_Time  Command/Feature_Name
  -- == -- == -- == == == -- -- -- -- --  ---------------  --------------------
  25 00 00 01 00 00 00 02 b1 44 7d e0 00  5d+14:11:29.384  READ DMA EXT
  35 00 00 00 08 00 00 03 bb f7 65 e0 00  5d+14:11:29.349  WRITE DMA EXT
  35 00 00 00 10 00 00 03 bb f6 c5 e0 00  5d+14:11:29.349  WRITE DMA EXT
  35 00 00 00 08 00 00 03 bb f5 0d e0 00  5d+14:11:29.348  WRITE DMA EXT
  35 00 00 00 08 00 00 03 bb f4 ed e0 00  5d+14:11:29.348  WRITE DMA EXT

Error 484 [3] occurred at disk power-on lifetime: 16221 hours (675 days + 21 hours)
  When the command that caused the error occurred, the device was active or idle.

  After command completion occurred, registers were:
  ER -- ST COUNT  LBA_48  LH LM LL DV DC
  -- -- -- == -- == == == -- -- -- -- --
  40 -- 51 00 00 00 00 02 b1 44 a8 00 00  Error: UNC at LBA = 0x02b144a8 = 45171880

  Commands leading to the command that caused the error were:
  CR FEATR COUNT  LBA_48  LH LM LL DV DC  Powered_Up_Time  Command/Feature_Name
  -- == -- == -- == == == -- -- -- -- --  ---------------  --------------------
  25 00 00 00 20 00 00 02 b1 44 8d e0 00  5d+14:11:25.286  READ DMA EXT
  35 00 00 00 10 00 00 01 a2 0d bd e0 00  5d+14:11:25.235  WRITE DMA EXT
  35 00 00 00 10 00 00 03 bb bd d5 e0 00  5d+14:11:25.207  WRITE DMA EXT
  35 00 00 00 08 00 00 03 bb bd 9d e0 00  5d+14:11:25.207  WRITE DMA EXT
  35 00 00 00 08 00 00 03 bb bd 45 e0 00  5d+14:11:25.206  WRITE DMA EXT

Error 483 [2] occurred at disk power-on lifetime: 16221 hours (675 days + 21 hours)
  When the command that caused the error occurred, the device was active or idle.

  After command completion occurred, registers were:
  ER -- ST COUNT  LBA_48  LH LM LL DV DC
  -- -- -- == -- == == == -- -- -- -- --
  40 -- 51 00 00 00 00 02 b1 44 a8 00 00  Error: UNC at LBA = 0x02b144a8 = 45171880

  Commands leading to the command that caused the error were:
  CR FEATR COUNT  LBA_48  LH LM LL DV DC  Powered_Up_Time  Command/Feature_Name
  -- == -- == -- == == == -- -- -- -- --  ---------------  --------------------
  25 00 00 01 00 00 00 02 b1 44 7d e0 00  5d+14:10:18.322  READ DMA EXT
  35 00 00 00 20 00 00 0f 97 9e 2d e0 00  5d+14:10:18.321  WRITE DMA EXT
  35 00 00 00 20 00 00 0f 99 e5 0d e0 00  5d+14:10:18.271  WRITE DMA EXT
  35 00 00 01 00 00 00 0f 99 e4 0d e0 00  5d+14:10:18.270  WRITE DMA EXT
  35 00 00 01 00 00 00 0f 99 e3 0d e0 00  5d+14:10:18.270  WRITE DMA EXT

Error 482 [1] occurred at disk power-on lifetime: 16221 hours (675 days + 21 hours)
  When the command that caused the error occurred, the device was active or idle.

  After command completion occurred, registers were:
  ER -- ST COUNT  LBA_48  LH LM LL DV DC
  -- -- -- == -- == == == -- -- -- -- --
  40 -- 51 00 00 00 00 02 b1 44 ad 00 00  Error: UNC at LBA = 0x02b144ad = 45171885

  Commands leading to the command that caused the error were:
  CR FEATR COUNT  LBA_48  LH LM LL DV DC  Powered_Up_Time  Command/Feature_Name
  -- == -- == -- == == == -- -- -- -- --  ---------------  --------------------
  25 00 00 00 08 00 00 02 b1 44 ad e0 00  5d+14:10:14.328  READ DMA EXT
  35 00 00 00 08 00 00 00 41 f1 5d e0 00  5d+14:10:14.280  WRITE DMA EXT
  35 00 00 00 08 00 00 00 41 f1 6d e0 00  5d+14:10:14.279  WRITE DMA EXT
  35 00 00 00 20 00 00 00 43 cb 75 e0 00  5d+14:10:14.279  WRITE DMA EXT
  25 00 00 00 08 00 00 02 b1 44 a5 e0 00  5d+14:10:10.490  READ DMA EXT

Error 481 [0] occurred at disk power-on lifetime: 16221 hours (675 days + 21 hours)
  When the command that caused the error occurred, the device was active or idle.

  After command completion occurred, registers were:
  ER -- ST COUNT  LBA_48  LH LM LL DV DC
  -- -- -- == -- == == == -- -- -- -- --
  40 -- 51 00 00 00 00 02 b1 44 a8 00 00  Error: UNC at LBA = 0x02b144a8 = 45171880

  Commands leading to the command that caused the error were:
  CR FEATR COUNT  LBA_48  LH LM LL DV DC  Powered_Up_Time  Command/Feature_Name
  -- == -- == -- == == == -- -- -- -- --  ---------------  --------------------
  25 00 00 00 08 00 00 02 b1 44 a5 e0 00  5d+14:10:10.490  READ DMA EXT
  25 00 00 00 08 00 00 02 b1 44 9d e0 00  5d+14:10:10.489  READ DMA EXT
  25 00 00 00 08 00 00 02 b1 44 95 e0 00  5d+14:10:10.415  READ DMA EXT
  25 00 00 00 08 00 00 02 b1 44 8d e0 00  5d+14:10:10.415  READ DMA EXT
  25 00 00 00 08 00 00 02 b1 44 85 e0 00  5d+14:10:10.414  READ DMA EXT

Error 480 [19] occurred at disk power-on lifetime: 16221 hours (675 days + 21 hours)
  When the command that caused the error occurred, the device was active or idle.

  After command completion occurred, registers were:
  ER -- ST COUNT  LBA_48  LH LM LL DV DC
  -- -- -- == -- == == == -- -- -- -- --
  40 -- 51 00 00 00 00 02 b1 44 a8 00 00  Error: UNC at LBA = 0x02b144a8 = 45171880

  Commands leading to the command that caused the error were:
  CR FEATR COUNT  LBA_48  LH LM LL DV DC  Powered_Up_Time  Command/Feature_Name
  -- == -- == -- == == == -- -- -- -- --  ---------------  --------------------
  25 00 00 01 00 00 00 02 b1 44 6d e0 00  5d+14:10:06.461  READ DMA EXT
  35 00 00 00 08 00 00 03 bb f7 45 e0 00  5d+14:10:06.413  WRITE DMA EXT
  35 00 00 00 08 00 00 03 bb f6 15 e0 00  5d+14:10:06.413  WRITE DMA EXT
  ea 00 00 00 00 97 9e 4c 00 00 00 a0 00  5d+14:10:06.395  FLUSH CACHE EXT
  35 00 00 00 20 00 00 0f 97 9e 2d e0 00  5d+14:10:06.395  WRITE DMA EXT

Error 479 [18] occurred at disk power-on lifetime: 16221 hours (675 days + 21 hours)
  When the command that caused the error occurred, the device was active or idle.

  After command completion occurred, registers were:
  ER -- ST COUNT  LBA_48  LH LM LL DV DC
  -- -- -- == -- == == == -- -- -- -- --
  40 -- 51 00 00 00 00 02 b1 44 a8 00 00  Error: UNC at LBA = 0x02b144a8 = 45171880

  Commands leading to the command that caused the error were:
  CR FEATR COUNT  LBA_48  LH LM LL DV DC  Powered_Up_Time  Command/Feature_Name
  -- == -- == -- == == == -- -- -- -- --  ---------------  --------------------
  25 00 00 00 20 00 00 02 b1 44 8d e0 00  5d+14:10:02.157  READ DMA EXT
  35 00 00 00 10 00 00 00 54 d8 9d e0 00  5d+14:10:02.155  WRITE DMA EXT
  25 00 00 00 10 00 00 02 b1 44 7d e0 00  5d+14:10:02.146  READ DMA EXT
  35 00 00 00 20 00 00 0f 97 9e 2d e0 00  5d+14:10:02.145  WRITE DMA EXT
  35 00 00 00 20 00 00 0f 99 e2 6d e0 00  5d+14:10:02.145  WRITE DMA EXT

Error 478 [17] occurred at disk power-on lifetime: 16067 hours (669 days + 11 hours)
  When the command that caused the error occurred, the device was active or idle.

  After command completion occurred, registers were:
  ER -- ST COUNT  LBA_48  LH LM LL DV DC
  -- -- -- == -- == == == -- -- -- -- --
  40 -- 51 00 00 00 00 02 b1 44 a8 00 00  Error: UNC at LBA = 0x02b144a8 = 45171880

  Commands leading to the command that caused the error were:
  CR FEATR COUNT  LBA_48  LH LM LL DV DC  Powered_Up_Time  Command/Feature_Name
  -- == -- == -- == == == -- -- -- -- --  ---------------  --------------------
  25 00 00 01 00 00 00 02 b1 44 7d e0 00     03:26:52.552  READ DMA EXT
  35 00 00 00 08 00 00 00 49 39 ad e0 00     03:26:52.505  WRITE DMA EXT
  35 00 00 00 08 00 00 00 49 3a 8d e0 00     03:26:52.505  WRITE DMA EXT
  35 00 00 00 08 00 00 02 ac ad 35 e0 00     03:26:52.504  WRITE DMA EXT
  35 00 00 00 20 00 00 00 9e a9 e5 e0 00     03:26:52.504  WRITE DMA EXT

SMART Extended Self-test Log Version: 1 (1 sectors)
Num  Test_Description    Status                  Remaining  LifeTime(hours)  LBA_of_first_error
# 1  Short offline       Completed without error       00%         0         -

SMART Selective self-test log data structure revision number 1
 SPAN  MIN_LBA  MAX_LBA  CURRENT_TEST_STATUS
    1        0        0  Not_testing
    2        0        0  Not_testing
    3        0        0  Not_testing
    4        0        0  Not_testing
    5        0        0  Not_testing
Selective self-test flags (0x0):
  After scanning selected spans, do NOT read-scan remainder of disk.
If Selective self-test is pending on power-up, resume after 0 minute delay.

SCT Status Version:                  3
SCT Version (vendor specific):       522 (0x020a)
Device State:                        Active (0)
Current Temperature:                    35 Celsius
Power Cycle Min/Max Temperature:     34/36 Celsius
Lifetime    Min/Max Temperature:     12/39 Celsius
Under/Over Temperature Limit Count:   0/0

SCT Temperature History Version:     2
Temperature Sampling Period:         1 minute
Temperature Logging Interval:        59 minutes
Min/Max recommended Temperature:     14/55 Celsius
Min/Max Temperature Limit:           10/60 Celsius
Temperature History Size (Index):    128 (104)

Index    Estimated Time   Temperature Celsius
 105    2026-05-26 17:23    34  ***************
 106    2026-05-26 18:22    34  ***************
 107    2026-05-26 19:21    34  ***************
 108    2026-05-26 20:20    35  ****************
 ...    ..( 10 skipped).    ..  ****************
 119    2026-05-27 07:09    35  ****************
 120    2026-05-27 08:08    34  ***************
 ...    ..(  2 skipped).    ..  ***************
 123    2026-05-27 11:05    34  ***************
 124    2026-05-27 12:04    35  ****************
 ...    ..(  9 skipped).    ..  ****************
   6    2026-05-27 21:54    35  ****************
   7    2026-05-27 22:53    34  ***************
 ...    ..(  4 skipped).    ..  ***************
  12    2026-05-28 03:48    34  ***************
  13    2026-05-28 04:47    33  **************
 ...    ..(  3 skipped).    ..  **************
  17    2026-05-28 08:43    33  **************
  18    2026-05-28 09:42    34  ***************
 ...    ..(  2 skipped).    ..  ***************
  21    2026-05-28 12:39    34  ***************
  22    2026-05-28 13:38    35  ****************
 ...    ..( 12 skipped).    ..  ****************
  35    2026-05-29 02:25    35  ****************
  36    2026-05-29 03:24    34  ***************
 ...    ..(  6 skipped).    ..  ***************
  43    2026-05-29 10:17    34  ***************
  44    2026-05-29 11:16    33  **************
  45    2026-05-29 12:15    33  **************
  46    2026-05-29 13:14    33  **************
  47    2026-05-29 14:13    34  ***************
  48    2026-05-29 15:12    34  ***************
  49    2026-05-29 16:11    34  ***************
  50    2026-05-29 17:10    35  ****************
 ...    ..(  2 skipped).    ..  ****************
  53    2026-05-29 20:07    35  ****************
  54    2026-05-29 21:06    34  ***************
  55    2026-05-29 22:05    34  ***************
  56    2026-05-29 23:04    34  ***************
  57    2026-05-30 00:03    35  ****************
 ...    ..(  7 skipped).    ..  ****************
  65    2026-05-30 07:55    35  ****************
  66    2026-05-30 08:54    34  ***************
  67    2026-05-30 09:53    34  ***************
  68    2026-05-30 10:52    35  ****************
  69    2026-05-30 11:51    34  ***************
  70    2026-05-30 12:50    34  ***************
  71    2026-05-30 13:49    36  *****************
  72    2026-05-30 14:48    36  *****************
  73    2026-05-30 15:47    36  *****************
  74    2026-05-30 16:46    35  ****************
 ...    ..(  6 skipped).    ..  ****************
  81    2026-05-30 23:39    35  ****************
  82    2026-05-31 00:38    36  *****************
  83    2026-05-31 01:37    36  *****************
  84    2026-05-31 02:36    35  ****************
  85    2026-05-31 03:35    35  ****************
  86    2026-05-31 04:34    34  ***************
 ...    ..(  4 skipped).    ..  ***************
  91    2026-05-31 09:29    34  ***************
  92    2026-05-31 10:28    33  **************
  93    2026-05-31 11:27    33  **************
  94    2026-05-31 12:26    33  **************
  95    2026-05-31 13:25    35  ****************
  96    2026-05-31 14:24    34  ***************
 ...    ..(  4 skipped).    ..  ***************
 101    2026-05-31 19:19    34  ***************
 102    2026-05-31 20:18     ?  -
 103    2026-05-31 21:17    35  ****************
 104    2026-05-31 22:16    34  ***************

SCT Error Recovery Control:
           Read: Disabled
          Write: Disabled

Device Statistics (GP/SMART Log 0x04) not supported

Pending Defects log (GP Log 0x0c) not supported

SATA Phy Event Counters (GP Log 0x11)
ID      Size     Value  Description
0x000a  2            2  Device-to-host register FISes sent due to a COMRESET
0x0001  2            0  Command failed due to ICRC error
0x0003  2            0  R_ERR response for device-to-host data FIS
0x0004  2            0  R_ERR response for host-to-device data FIS
0x0006  2            0  R_ERR response for device-to-host non-data FIS
0x0007  2            0  R_ERR response for host-to-device non-data FIS

